{
  "schema": "postfiat-constitutional-decision-packet-v1",
  "decision_id": "vc-privacy-architecture-001-decision-001",
  "decision_version": 1,
  "status": "accepted",
  "decision_scope": "privacy",
  "created_at": "2026-05-25T00:00:00Z",
  "evidence_packet_ref": {
    "packet_id": "vc-privacy-architecture-001-evidence-001",
    "packet_path": "docs/governance/agent/fixtures/verifiable_constitution/privacy_constitutional_evidence_packet.json",
    "packet_file_sha3_384": "21504b2736c61c6961c05d612f84789b3a8c55caa3af459d36a95ed4333b79f7ebc7e751ccadad4a25c254bce5814fee",
    "packet_canonical_hash": "d0f7b9ed0191968e8a0ac88fc7f407f6d132fe01fa69aef1c57c2d07957bc4f00196120d6b7d1a14529d07ecce3b6f26",
    "evidence_root": "b79321ac0df5cebd3fef5828e6994e1699dac86886e52f247e452a3cb92916c83a044fb9c897516ef019c41edc80634e",
    "packet_schema_path": "docs/governance/agent/constitutional_evidence_packet_schema.json",
    "packet_schema_sha3_384": "5019bce76ede61a24de4c617f1b6f1275d701907c733267541ae95999aa1540ca97d00403fb65389703f5f0ea44837f2"
  },
  "decision_generation": {
    "authoring_mode": "schema_fixture",
    "model_output_generated": false,
    "model_profile_id": null,
    "model_request_hash": null,
    "raw_output_hash": null,
    "parsed_output_hash": null,
    "replay_required_before_authority": true
  },
  "selected_option": {
    "option_id": "preserve-orchard-halo2",
    "decision_kind": "preserve_status_quo",
    "confidence": "medium",
    "rationale": "The approved non-validator evidence packet supports preserving the current status quo while live effects remain gated.",
    "evidence_ref_paths": [
      "privacy.status_quo_hash",
      "privacy.implementation_refs_hash",
      "privacy.evidence_refs_hash",
      "privacy.closed_option_set_hash"
    ]
  },
  "rejected_options": [
    {
      "option_id": "adopt-attestation-privacy",
      "rejection_kind": "missing_evidence",
      "reason": "The current approved packet only supports preserving the non-validator status quo.",
      "evidence_ref_paths": [
        "privacy.status_quo_hash",
        "privacy.implementation_refs_hash",
        "privacy.evidence_refs_hash",
        "privacy.closed_option_set_hash"
      ]
    },
    {
      "option_id": "hybrid-orchard-attestation-disclosure",
      "rejection_kind": "missing_evidence",
      "reason": "The current approved packet only supports preserving the non-validator status quo.",
      "evidence_ref_paths": [
        "privacy.status_quo_hash",
        "privacy.implementation_refs_hash",
        "privacy.evidence_refs_hash",
        "privacy.closed_option_set_hash"
      ]
    },
    {
      "option_id": "hold-no-op",
      "rejection_kind": "missing_evidence",
      "reason": "The current approved packet only supports preserving the non-validator status quo.",
      "evidence_ref_paths": [
        "privacy.status_quo_hash",
        "privacy.implementation_refs_hash",
        "privacy.evidence_refs_hash",
        "privacy.closed_option_set_hash"
      ]
    }
  ],
  "evidence_refs": [
    {
      "field_path": "privacy.status_quo_hash",
      "evidence_status": "present",
      "evidence_root": "b79321ac0df5cebd3fef5828e6994e1699dac86886e52f247e452a3cb92916c83a044fb9c897516ef019c41edc80634e",
      "supports": "selected_option"
    },
    {
      "field_path": "privacy.implementation_refs_hash",
      "evidence_status": "present",
      "evidence_root": "b79321ac0df5cebd3fef5828e6994e1699dac86886e52f247e452a3cb92916c83a044fb9c897516ef019c41edc80634e",
      "supports": "selected_option"
    },
    {
      "field_path": "privacy.evidence_refs_hash",
      "evidence_status": "present",
      "evidence_root": "b79321ac0df5cebd3fef5828e6994e1699dac86886e52f247e452a3cb92916c83a044fb9c897516ef019c41edc80634e",
      "supports": "selected_option"
    },
    {
      "field_path": "privacy.closed_option_set_hash",
      "evidence_status": "present",
      "evidence_root": "b79321ac0df5cebd3fef5828e6994e1699dac86886e52f247e452a3cb92916c83a044fb9c897516ef019c41edc80634e",
      "supports": "selected_option"
    }
  ],
  "implementation_consequences": [
    {
      "consequence_id": "privacy-preserve-status-quo",
      "effect": "no_code_change",
      "description": "No live implementation effect is authorized by this non-validator decision packet.",
      "evidence_ref_paths": [
        "privacy.status_quo_hash",
        "privacy.implementation_refs_hash",
        "privacy.evidence_refs_hash",
        "privacy.closed_option_set_hash"
      ],
      "requires_later_authorization": false
    }
  ],
  "invalidation_criteria": [
    {
      "criterion_id": "privacy-evidence-root-drift",
      "description": "Hold if the approved evidence root changes or cannot be recomputed.",
      "evidence_ref_paths": [
        "privacy.status_quo_hash",
        "privacy.implementation_refs_hash",
        "privacy.evidence_refs_hash",
        "privacy.closed_option_set_hash"
      ],
      "effect": "hold"
    },
    {
      "criterion_id": "privacy-hidden-evidence",
      "description": "Reject if hidden evidence, secret material, or unregistered fields enter the packet.",
      "evidence_ref_paths": [
        "privacy.status_quo_hash",
        "privacy.implementation_refs_hash",
        "privacy.evidence_refs_hash",
        "privacy.closed_option_set_hash"
      ],
      "effect": "reject_decision"
    },
    {
      "criterion_id": "privacy-new-option-needed",
      "description": "Reopen the question if a missing option is required to describe the safe action.",
      "evidence_ref_paths": [
        "privacy.status_quo_hash",
        "privacy.implementation_refs_hash",
        "privacy.evidence_refs_hash",
        "privacy.closed_option_set_hash"
      ],
      "effect": "reopen_question"
    }
  ],
  "fallback": {
    "decision": "no_op",
    "trigger_conditions": [
      "missing_evidence",
      "ambiguous_evidence",
      "schema_invalid",
      "replay_drift",
      "hidden_evidence_attempt",
      "scope_expansion_attempt",
      "unsafe_live_action_attempt"
    ],
    "rationale": "The packet remains advisory until replay, challenge, conformance, and live authorization gates pass."
  },
  "authority_boundary": {
    "live_registry_mutation_authorized": false,
    "live_cobalt_amendment_submission_authorized": false,
    "model_promotion_authorized": false,
    "authority_transfer_authorized": false,
    "sidecar_activation_authorized": false,
    "default_conformance_requires_later_gate": true
  },
  "checks": {
    "selected_option_in_question": true,
    "selected_option_evidence_bound": true,
    "rejected_options_evidence_bound": true,
    "implementation_consequences_present": true,
    "invalidation_criteria_present": true,
    "fallback_present": true,
    "no_hidden_evidence": true,
    "no_secret_dependency": true,
    "no_live_mutation": true,
    "authority_transfer": false
  }
}
